{
  "id": "ef:source_platform_card:shahed-136-geran-2:0123456789abcdef:1",
  "kind": "source_platform_card",
  "schema_version": "1.0.0",
  "public_proxy_id": "shahed-136-geran-2",
  "provenance": {
    "source_kind": "public_proxy",
    "source_refs": [
      "osmp.ngo Shahed-136 visual guide",
      "RUSI Russian Iranian-made UAV technical profile",
      "Janes Shahed-136 entry",
      "object-packs/public-proxy/physics_dossier.md (existing dossier — full-fidelity refinement of public-proxy-uav)",
      "Rahman & Robertson Nature Sci Rep 2018 (8:17396) — bird vs UAS micro-Doppler",
      "Karlsson 77 GHz / MDPI Drones 2023 7(1):39 — small UAV RCS reference",
      "Limbach L550E technical data — engine proxy",
      "tips/problem_deep_dive/tip10.txt:1-35"
    ],
    "generated_by": "echoforge-tooling",
    "generated_at": "2026-05-18T21:00:00Z",
    "fingerprint_sha256": "0000000000000000000000000000000000000000000000000000000000000000"
  },
  "license": {
    "spdx_id": "MIT",
    "notice": "Public-proxy fixture. All parameters derived from open-source reporting. NOT a measured-truth claim. Strict-open per current plan."
  },
  "validation": {
    "tier": "cross_checked",
    "status": "pass",
    "uncertainty_score": 0.35,
    "checks": [
      {
        "name": "geometry_dimensions_cited",
        "status": "pass",
        "message": "3.5m L / 2.5m WS / 0.55m H — OSMP + Janes + Army Recognition agree"
      },
      {
        "name": "blade_pass_consistency",
        "status": "pass",
        "message": "f_blade_pass = blade_count × rpm/60 = 2 × [4500,6500]/60 = [150, 217] Hz — matches declared blade_pass_fundamental_hz_range [150, 220]"
      },
      {
        "name": "rcs_envelope_within_published_class",
        "status": "warn",
        "message": "X-band nose-on [-25, -18] dBsm consistent with VTT 15/25 GHz envelope for small fixed-wing UAS; full measured Shahed truth unavailable per strict-open"
      },
      {
        "name": "naming_policy_compliance",
        "status": "pass",
        "message": "Shahed-136 / Geran-2 designation allowed per 20260518T160000Z naming-policy reversal"
      }
    ],
    "fidelity_class": "production_sbr"
  },
  "display_name": "Shahed-136 / Geran-2",
  "platform_family": "one_way_attack_uav",
  "platform_role": "adversary",
  "country_of_origin": "IRN-RUS",
  "dimensions_m": {
    "x": 3.5,
    "y": 2.5,
    "z": 0.55
  },
  "wingspan_m": 2.5,
  "fuselage_diameter_m": 0.5,
  "wing_chord_root_m": 0.6,
  "wing_chord_tip_m": 0.3,
  "mass_kg": {
    "min": 180.0,
    "max": 220.0
  },
  "warhead_mass_kg": {
    "min": 30.0,
    "max": 90.0
  },
  "propulsion": {
    "propulsion_type": "rocket_solid_then_piston",
    "engine_model_proxy": "mado-md-550",
    "rated_power_kw": { "min": 26.0, "max": 37.0 },
    "rated_power_hp": { "min": 35.0, "max": 50.0 },
    "propeller": {
      "blade_count": 2,
      "blade_length_m": 0.55,
      "blade_chord_m": 0.085,
      "prop_diameter_m": 1.1,
      "rated_rpm_range": { "min": 4500.0, "max": 6500.0 },
      "idle_rpm_range": { "min": 2000.0, "max": 2500.0 },
      "configuration": "pusher"
    },
    "rocket_booster": {
      "burn_time_s_range": { "min": 1.0, "max": 2.0 },
      "peak_acceleration_g": 1.8,
      "exit_velocity_mps_range": { "min": 25.0, "max": 35.0 }
    }
  },
  "kinematic_envelope": {
    "cruise_speed_mps": { "min": 45.0, "max": 60.0 },
    "max_speed_mps": { "min": 50.0, "max": 65.0 },
    "min_sustainable_airspeed_mps": 35.0,
    "stall_airspeed_mps": 28.0,
    "climb_rate_mps": { "min": 1.5, "max": 4.0 },
    "descent_rate_mps": { "min": 2.0, "max": 6.0 },
    "operational_altitude_bands_m_agl": [
      { "name": "low_ingress", "min": 60.0, "max": 200.0 },
      { "name": "transit_cruise", "min": 500.0, "max": 1500.0 },
      { "name": "high_loiter", "min": 1500.0, "max": 4000.0 }
    ],
    "max_altitude_m_agl": 4000.0,
    "endurance_hours": { "min": 6.0, "max": 10.0 },
    "range_km": { "min": 1000.0, "max": 2500.0 },
    "turn_rate_max_deg_s": 12.0,
    "sustained_g_max": 2.0,
    "instantaneous_g_max": 3.5,
    "max_bank_angle_deg": 45.0
  },
  "launch_method": "rail_with_rocket_booster",
  "terminal_behavior": "cruise_then_impact",
  "guidance": {
    "primary_navigation": "gnss_plus_ins",
    "datalink_present": false
  },
  "rcs_signature": {
    "fluctuation_model": "swerling_1",
    "bands": [
      {
        "band_name": "S",
        "center_frequency_hz": 3.0e9,
        "polarization": "averaged",
        "aspect_envelopes": [
          {
            "aspect_name": "nose_on",
            "aspect_azimuth_deg_range": { "min": -20.0, "max": 20.0 },
            "elevation_deg_range": { "min": -10.0, "max": 10.0 },
            "rcs_dbsm_range": { "min": -22.0, "max": -14.0 },
            "citation_id": "vtt-25ghz-scaled-s-band"
          },
          {
            "aspect_name": "broadside_left",
            "aspect_azimuth_deg_range": { "min": 70.0, "max": 110.0 },
            "elevation_deg_range": { "min": -10.0, "max": 10.0 },
            "rcs_dbsm_range": { "min": -10.0, "max": -3.0 },
            "citation_id": "vtt-25ghz-scaled-s-band"
          },
          {
            "aspect_name": "tail_on",
            "aspect_azimuth_deg_range": { "min": 160.0, "max": 200.0 },
            "elevation_deg_range": { "min": -10.0, "max": 10.0 },
            "rcs_dbsm_range": { "min": -20.0, "max": -12.0 },
            "citation_id": "vtt-25ghz-scaled-s-band"
          }
        ]
      },
      {
        "band_name": "X",
        "center_frequency_hz": 10.0e9,
        "polarization": "averaged",
        "aspect_envelopes": [
          {
            "aspect_name": "nose_on",
            "aspect_azimuth_deg_range": { "min": -20.0, "max": 20.0 },
            "elevation_deg_range": { "min": -10.0, "max": 10.0 },
            "rcs_dbsm_range": { "min": -25.0, "max": -18.0 },
            "citation_id": "rahman-robertson-2018-fixed-wing-class"
          },
          {
            "aspect_name": "broadside_left",
            "aspect_azimuth_deg_range": { "min": 70.0, "max": 110.0 },
            "elevation_deg_range": { "min": -10.0, "max": 10.0 },
            "rcs_dbsm_range": { "min": -12.0, "max": -5.0 },
            "citation_id": "mdpi-drones-2023-fixed-wing-broadside"
          },
          {
            "aspect_name": "tail_on",
            "aspect_azimuth_deg_range": { "min": 160.0, "max": 200.0 },
            "elevation_deg_range": { "min": -10.0, "max": 10.0 },
            "rcs_dbsm_range": { "min": -22.0, "max": -15.0 },
            "citation_id": "rahman-robertson-2018-fixed-wing-class"
          }
        ]
      }
    ]
  },
  "micro_doppler_signature": {
    "dominant_modulation_source": "propeller",
    "blade_pass_fundamental_hz_range": { "min": 150.0, "max": 220.0 },
    "rotation_fundamental_hz_range": { "min": 75.0, "max": 110.0 },
    "harmonic_count": 3,
    "amplitude_modulation_depth_db_range": { "min": 1.0, "max": 4.0 },
    "aspect_visibility": [
      { "aspect_name": "nose_on", "visibility_score": 0.85 },
      { "aspect_name": "broadside", "visibility_score": 0.30 },
      { "aspect_name": "tail_on", "visibility_score": 0.95 },
      { "aspect_name": "above", "visibility_score": 0.60 },
      { "aspect_name": "below", "visibility_score": 0.55 }
    ]
  },
  "ir_signature": {
    "lwir_temperature_delta_k": { "min": 40.0, "max": 120.0 },
    "mwir_temperature_delta_k": { "min": 60.0, "max": 180.0 },
    "plume_present": false,
    "engine_exhaust_temperature_c": { "min": 220.0, "max": 380.0 },
    "fuselage_solar_load_w_per_m2_range": { "min": 250.0, "max": 700.0 }
  },
  "acoustic_signature": {
    "spl_at_100m_db_range": { "min": 65.0, "max": 82.0 },
    "dominant_tonal_hz_range": { "min": 150.0, "max": 220.0 },
    "engine_fundamental_hz_range": { "min": 75.0, "max": 110.0 },
    "blade_harmonic_hz_range": { "min": 150.0, "max": 660.0 },
    "broadband_band_db": {
      "low_hz_to_500hz_db": 70.0,
      "five_hundred_hz_to_2khz_db": 60.0,
      "two_to_10khz_db": 50.0
    },
    "directivity": "rear_quadrant"
  },
  "rf_emissions": {
    "silent_default": true,
    "gnss_receiver_active": true,
    "gnss_band": "L1",
    "control_link_present": false
  },
  "aliases": ["Shahed-136", "Geran-2", "HESA Shahed-136"],
  "source_refs": [
    {
      "citation_id": "osmp-shahed-136-visual-guide",
      "url": "https://osmp.ngo/shahed-136",
      "title": "Open Source Munitions Portal — Shahed-136 visual guide",
      "publisher": "OSMP",
      "retrieved_utc": "2026-05-18T20:00:00Z"
    },
    {
      "citation_id": "rusi-shahed-technical-profile",
      "url": "https://rusi.org/shahed-technical-profile",
      "title": "RUSI — Russian Iranian-made UAV technical profile",
      "publisher": "Royal United Services Institute",
      "retrieved_utc": "2026-05-18T20:00:00Z"
    },
    {
      "citation_id": "rahman-robertson-2018-fixed-wing-class",
      "url": "https://www.nature.com/articles/s41598-018-35476-6",
      "title": "Rahman & Robertson — Bird vs UAS micro-Doppler",
      "publisher": "Nature Scientific Reports 8:17396",
      "retrieved_utc": "2026-05-18T20:00:00Z"
    },
    {
      "citation_id": "mdpi-drones-2023-fixed-wing-broadside",
      "url": "https://www.mdpi.com/2504-446X/7/1/39",
      "title": "Small fixed-wing UAV RCS signature investigation",
      "publisher": "MDPI Drones 2023 7(1):39",
      "retrieved_utc": "2026-05-18T20:00:00Z"
    },
    {
      "citation_id": "vtt-25ghz-scaled-s-band",
      "url": "internal://tips/science_stack/current/tip1.txt",
      "title": "VTT 15/25 GHz small-UAS RCS measurements, scaled to S-band via Rayleigh-region frequency dependence",
      "publisher": "VTT / EchoForge internal scaling note",
      "retrieved_utc": "2026-05-18T20:00:00Z"
    }
  ],
  "tags": [
    "adversary",
    "one_way_attack_uav",
    "loitering_munition",
    "iranian_origin",
    "russian_operated",
    "delta_wing",
    "piston_pusher",